{
    "commitInterval": "PT10S",
    "enableBackup": false,
    "historizedSymbolList": {
        "PLC1.MAIN.fSin": {
            "interval": "PT1S",
            "maxEntries": 10000,
            "recordingEnabled": true,
            "rowLimit": 100000
        }
    },
    "inMemory": false,
    "maxBackups": 1,
    "mode": 3,
    "vacuumOnStartup": false
}